{
  "meta": {
    "type": "daily-news",
    "date": "2026-06-17",
    "generatedAt": "2026-06-17T09:18:00+08:00",
    "skillVersion": "codex-curated-daily-news-v3",
    "sourceCount": 2,
    "itemCount": 5,
    "candidateCount": 5,
    "selectionRule": "从 2026-06-17 当日可核验的中国政府网和新华网原文中，优先选择党建理论、公共卫生国际合作与营商环境治理主题，兼顾政策密度与备考价值。",
    "scopeNote": "本期收录 2026-06-17 发布于中国政府网和新华网的可核验报道或评论。事件事实来自原文，申论角度、行测关联与出题方向为备考加工内容。",
    "verifiedAt": "2026-06-17 09:18 +08:00"
  },
  "date": "2026-06-17",
  "title": "2026-06-17 每日时政热点",
  "summary": "今日重点关注习近平党建思想学习贯彻、非洲应对埃博拉疫情合作，以及地方政府招商角色边界等治理议题。",
  "candidateSources": [
    {
      "name": "中国政府网要闻列表",
      "url": "https://www.gov.cn/yaowen/liebiao/",
      "checkedAt": "2026-06-17 09:18 +08:00",
      "result": "核验当日要闻列表，确认 3 篇 2026-06-17 发布原文。"
    },
    {
      "name": "新华网评论频道",
      "url": "https://www.news.cn/comments/",
      "checkedAt": "2026-06-17 09:18 +08:00",
      "result": "补充核验当日评论与新华网专题评论页，补足治理类备考素材。"
    }
  ],
  "candidatePool": [
    {
      "id": "candidate-20260617-001",
      "title": "人民日报评论员：加强新时代党的建设的根本遵循——论学习贯彻习近平党建思想",
      "source": "人民日报评论员（中国政府网发布）",
      "url": "https://www.gov.cn/yaowen/liebiao/202606/content_7072418.htm",
      "publishTime": "2026-06-17",
      "reason": "党建理论权威表述集中，适合作为政治理论与申论表达储备。",
      "selected": true
    },
    {
      "id": "candidate-20260617-002",
      "title": "锻造更加坚强有力的马克思主义执政党——习近平党建思想为深入推进新时代党的建设新的伟大工程指明方向",
      "source": "新华社（中国政府网发布）",
      "url": "https://www.gov.cn/yaowen/liebiao/202606/content_7072402.htm",
      "publishTime": "2026-06-17",
      "reason": "围绕全国党建工作座谈会展开，兼具时政事实和理论阐释。",
      "selected": true
    },
    {
      "id": "candidate-20260617-003",
      "title": "刘国中出席非洲应对埃博拉疫情特别视频峰会并致辞",
      "source": "新华社（中国政府网发布）",
      "url": "https://www.gov.cn/yaowen/liebiao/202606/content_7072391.htm",
      "publishTime": "2026-06-17",
      "reason": "公共卫生国际合作和对非援助议题明确，兼顾全球治理与卫生安全。",
      "selected": true
    },
    {
      "id": "candidate-20260617-004",
      "title": "本该做好“店小二”，就不要硬做“股东”",
      "source": "新华网",
      "url": "https://www.news.cn/comments/20260617/7aa8d26cffbb4997b46f7b0462f338fe/c.html",
      "publishTime": "2026-06-17",
      "reason": "聚焦政府与市场边界、招商引资角色定位，治理启发性强。",
      "selected": true
    },
    {
      "id": "candidate-20260617-005",
      "title": "新华社评论员：加强新时代党的建设的根本遵循——一论学习贯彻习近平党建思想",
      "source": "新华社评论员（新华网发布）",
      "url": "https://www.news.cn/politics/leaders/20260617/60b738c56e4345e0b01ec8b4754a902c/c.html",
      "publishTime": "2026-06-17",
      "reason": "从评论维度提炼习近平党建思想的系统内涵，便于大作文观点储备。",
      "selected": true
    }
  ],
  "items": [
    {
      "id": "news-20260617-001",
      "title": "人民日报评论员：加强新时代党的建设的根本遵循——论学习贯彻习近平党建思想",
      "source": "人民日报评论员（中国政府网发布）",
      "url": "https://www.gov.cn/yaowen/liebiao/202606/content_7072418.htm",
      "publishTime": "2026-06-17",
      "summary": "评论指出习近平党建思想围绕新时代党的建设重大课题形成系统理论成果，以“十四个坚持”集中概括党的建设最高原则、战略方针、价值追求和方法路径，为加强新时代党的建设提供根本遵循。",
      "keywords": [
        "习近平党建思想",
        "全面从严治党",
        "十四个坚持",
        "党的建设"
      ],
      "policyBackground": "党建理论是政治理论考查高频内容，既关系全面从严治党，也关系强国建设、民族复兴的政治保证。",
      "shenlunAngles": [
        {
          "title": "理论武装与政治建设",
          "explanation": "可从坚持党的领导、理论凝心铸魂和政治建设统领等方面组织论证。"
        },
        {
          "title": "以高质量党建引领高质量发展",
          "explanation": "将党的建设成效与治理能力、发展质量和改革落实结合起来分析。"
        }
      ],
      "xingceLinks": [
        {
          "module": "政治理论",
          "point": "习近平党建思想",
          "explanation": "重点记忆“十四个坚持”和全面从严治党的核心表述。"
        }
      ],
      "materials": [
        "治国必先治党，党兴才能国强。",
        "把党的建设抓实抓细，才能把事业发展的根基筑牢。"
      ],
      "examQuestions": [
        "结合新时代党的建设实践，谈谈为什么要坚持以党的政治建设为统领。",
        "围绕高质量党建引领高质量发展，拟写一段分论点。"
      ],
      "importance": 5,
      "tags": [
        "政治理论",
        "党建"
      ],
      "verification": {
        "verifiedAt": "2026-06-17 09:18 +08:00",
        "status": "verified",
        "note": "中国政府网原文已访问核验"
      }
    },
    {
      "id": "news-20260617-002",
      "title": "锻造更加坚强有力的马克思主义执政党——习近平党建思想为深入推进新时代党的建设新的伟大工程指明方向",
      "source": "新华社（中国政府网发布）",
      "url": "https://www.gov.cn/yaowen/liebiao/202606/content_7072402.htm",
      "publishTime": "2026-06-17",
      "summary": "报道围绕全国党建工作座谈会展开，指出习近平党建思想在马克思主义建党学说发展史和中国共产党党建史上具有里程碑意义，为推进新时代党的建设新的伟大工程提供坚强政治保证。",
      "keywords": [
        "全国党建工作座谈会",
        "马克思主义执政党",
        "伟大工程",
        "政治保证"
      ],
      "policyBackground": "理论成果最终要落到组织体系、干部队伍、作风建设和纪律建设等具体实践中，是申论概括与对策题常见切口。",
      "shenlunAngles": [
        {
          "title": "把理论成果转化为治理能力",
          "explanation": "可从组织建设、干部能力和责任落实等方面展开。"
        },
        {
          "title": "全面从严治党的实践逻辑",
          "explanation": "说明为什么党的建设成效会直接影响改革发展稳定大局。"
        }
      ],
      "xingceLinks": [
        {
          "module": "政治理论",
          "point": "新时代党的建设新的伟大工程",
          "explanation": "关注党建思想的形成背景和实践意义。"
        }
      ],
      "materials": [
        "理论创新的生命力，在于不断回应时代课题并指导实践。",
        "把党建设得更加坚强有力，才能赢得事业发展的历史主动。"
      ],
      "examQuestions": [
        "围绕新时代党的建设新的伟大工程，概括其现实意义。",
        "结合干部队伍建设，分析如何把理论优势转化为工作实效。"
      ],
      "importance": 5,
      "tags": [
        "党建",
        "理论学习"
      ],
      "verification": {
        "verifiedAt": "2026-06-17 09:18 +08:00",
        "status": "verified",
        "note": "中国政府网原文已访问核验"
      }
    },
    {
      "id": "news-20260617-003",
      "title": "刘国中出席非洲应对埃博拉疫情特别视频峰会并致辞",
      "source": "新华社（中国政府网发布）",
      "url": "https://www.gov.cn/yaowen/liebiao/202606/content_7072391.htm",
      "publishTime": "2026-06-17",
      "summary": "会议强调在构建人类卫生健康共同体理念下加强国际抗疫合作，中方已向刚果（金）和非盟提供紧急人道主义援助、派遣医疗专家组，并将在中非合作论坛框架内落实卫生健康伙伴行动。",
      "keywords": [
        "埃博拉",
        "中非合作",
        "公共卫生",
        "人类卫生健康共同体"
      ],
      "policyBackground": "全球公共卫生治理体现我国在发展援助、南南合作和国际责任上的政策取向，也是公共管理和国际关系的交叉考点。",
      "shenlunAngles": [
        {
          "title": "全球公共卫生合作",
          "explanation": "可从援助协同、能力建设和多边合作机制等方面展开。"
        },
        {
          "title": "中非命运共同体建设",
          "explanation": "卫生合作既是民生合作，也是提升全球治理参与度的重要抓手。"
        }
      ],
      "xingceLinks": [
        {
          "module": "常识判断",
          "point": "公共卫生与国际合作",
          "explanation": "关注人类卫生健康共同体、中非合作论坛等表述。"
        }
      ],
      "materials": [
        "公共卫生安全没有国界，合作是最有效的应对方式。",
        "把卫生合作做深做实，就是把命运共同体理念落到民生层面。"
      ],
      "examQuestions": [
        "结合埃博拉疫情应对，分析国际公共卫生合作为何重要。",
        "围绕中非卫生健康伙伴行动，提出可深化的合作方向。"
      ],
      "importance": 4,
      "tags": [
        "公共卫生",
        "国际合作"
      ],
      "verification": {
        "verifiedAt": "2026-06-17 09:18 +08:00",
        "status": "verified",
        "note": "中国政府网原文已访问核验"
      }
    },
    {
      "id": "news-20260617-004",
      "title": "本该做好“店小二”，就不要硬做“股东”",
      "source": "新华网",
      "url": "https://www.news.cn/comments/20260617/7aa8d26cffbb4997b46f7b0462f338fe/c.html",
      "publishTime": "2026-06-17",
      "summary": "评论聚焦一些地方政府在招商引资中通过产业基金等方式直接下场承担市场风险的现象，指出政府应当把重心放在营商环境、公共服务和产业配套上，而不是越位充当“股东”或“运动员”。",
      "keywords": [
        "营商环境",
        "招商引资",
        "政府与市场",
        "角色边界"
      ],
      "policyBackground": "建设全国统一大市场和优化营商环境，都要求政府守住规则制定者、服务提供者和公平竞争维护者的职责边界。",
      "shenlunAngles": [
        {
          "title": "政府与市场边界",
          "explanation": "可从有所为、有所不为的角度分析政府职能转变。"
        },
        {
          "title": "招商引资的长效政绩观",
          "explanation": "强调营商环境和公共服务这些“慢功夫”才是可持续竞争力。"
        }
      ],
      "xingceLinks": [
        {
          "module": "申论材料理解",
          "point": "问题归纳与原因分析",
          "explanation": "可练习概括角色错位、政绩冲动和风险兜底等问题。"
        }
      ],
      "materials": [
        "把规则守住了，市场才会把风险定价做出来。",
        "真正经得起检验的政绩，不在签约台上，而在企业能否扎根发展。"
      ],
      "examQuestions": [
        "分析地方政府在招商引资中应如何把握与市场的边界。",
        "围绕优化营商环境，提出减少越位干预的制度建议。"
      ],
      "importance": 5,
      "tags": [
        "营商环境",
        "政府治理"
      ],
      "verification": {
        "verifiedAt": "2026-06-17 09:18 +08:00",
        "status": "verified",
        "note": "新华网原文已访问核验"
      }
    },
    {
      "id": "news-20260617-005",
      "title": "新华社评论员：加强新时代党的建设的根本遵循——一论学习贯彻习近平党建思想",
      "source": "新华社评论员（新华网发布）",
      "url": "https://www.news.cn/politics/leaders/20260617/60b738c56e4345e0b01ec8b4754a902c/c.html",
      "publishTime": "2026-06-17",
      "summary": "评论从习近平党建思想的形成背景、理论品格和实践要求出发，强调其是新时代党的建设的根本遵循，要通过读原著学原文悟原理和学理化研究阐释，推动学习成果转化为全面从严治党实际成效。",
      "keywords": [
        "新华社评论员",
        "习近平党建思想",
        "理论学习",
        "全面从严治党"
      ],
      "policyBackground": "政治理论类评论既提供权威表达，也有助于备考时把理论概念转化为更完整的论证语言。",
      "shenlunAngles": [
        {
          "title": "学思用贯通",
          "explanation": "学习贯彻党的创新理论，关键在于把理解成果落实为工作谋划和制度执行。"
        },
        {
          "title": "理论宣传的表达转化",
          "explanation": "如何把彻底的理论讲彻底、讲鲜活，是宣传思想工作的重要要求。"
        }
      ],
      "xingceLinks": [
        {
          "module": "政治理论",
          "point": "党的创新理论学习要求",
          "explanation": "关注读原著、学原文、悟原理以及“两个确立”“两个维护”等表述。"
        }
      ],
      "materials": [
        "学习的目的全在于运用，理论的价值在于指导实践。",
        "把鲜活的思想讲鲜活，才能让理论真正进入干部群众头脑。"
      ],
      "examQuestions": [
        "结合理论学习工作，谈谈如何做到学思用贯通、知信行统一。",
        "围绕党的创新理论宣传阐释，提出提升传播效果的建议。"
      ],
      "importance": 4,
      "tags": [
        "理论学习",
        "党建"
      ],
      "verification": {
        "verifiedAt": "2026-06-17 09:18 +08:00",
        "status": "verified",
        "note": "新华网原文已访问核验"
      }
    }
  ]
}
