{
  "meta": {
    "type": "daily-news",
    "date": "2026-06-16",
    "generatedAt": "2026-06-17T09:18:00+08:00",
    "skillVersion": "codex-curated-daily-news-v3",
    "sourceCount": 1,
    "itemCount": 5,
    "candidateCount": 5,
    "selectionRule": "从中国政府网 2026-06-16 要闻中优先选择外交、经济运行和区域合作类权威原文，兼顾申论加工度与行测常识关联度。",
    "scopeNote": "本期收录 2026-06-16 发布于中国政府网的可核验原文。事件事实来自原文，申论角度、行测关联与出题方向为备考加工内容。",
    "verifiedAt": "2026-06-17 09:18 +08:00"
  },
  "date": "2026-06-16",
  "title": "2026-06-16 每日时政热点",
  "summary": "今日重点关注中缅高层会晤、5月份国民经济运行、上合组织合作以及中东热点斡旋进展。",
  "candidateSources": [
    {
      "name": "中国政府网要闻列表",
      "url": "https://www.gov.cn/yaowen/liebiao/",
      "checkedAt": "2026-06-17 09:18 +08:00",
      "result": "核验 2026-06-16 要闻列表并抽取外交、经济和区域合作相关原文。"
    }
  ],
  "candidatePool": [
    {
      "id": "candidate-20260616-001",
      "title": "习近平同缅甸总统敏昂莱会谈",
      "source": "新华社（中国政府网发布）",
      "url": "https://www.gov.cn/yaowen/liebiao/202606/content_7072296.htm",
      "publishTime": "2026-06-16",
      "reason": "周边外交、命运共同体和跨境安全合作议题集中，具备较高申论价值。",
      "selected": true
    },
    {
      "id": "candidate-20260616-002",
      "title": "李强会见缅甸总统敏昂莱",
      "source": "新华社（中国政府网发布）",
      "url": "https://www.gov.cn/yaowen/liebiao/202606/content_7072352.htm",
      "publishTime": "2026-06-16",
      "reason": "共建“一带一路”、数字经济和执法安全合作表述具体，适合政策梳理。",
      "selected": true
    },
    {
      "id": "candidate-20260616-003",
      "title": "5月份国民经济运行总体平稳、向新向优",
      "source": "国家统计局（中国政府网发布）",
      "url": "https://www.gov.cn/lianbo/202606/content_7072257.htm",
      "publishTime": "2026-06-16",
      "reason": "宏观经济数据权威、指标集中，适合作为经济类材料与常识积累。",
      "selected": true
    },
    {
      "id": "candidate-20260616-004",
      "title": "王毅出席上海合作组织成立25周年招待会",
      "source": "新华社（中国政府网发布）",
      "url": "https://www.gov.cn/yaowen/liebiao/202606/content_7072208.htm",
      "publishTime": "2026-06-16",
      "reason": "区域合作机制、全球治理和“上海精神”主题鲜明。",
      "selected": true
    },
    {
      "id": "candidate-20260616-005",
      "title": "王毅同巴基斯坦副总理兼外长达尔通电话",
      "source": "新华社（中国政府网发布）",
      "url": "https://www.gov.cn/yaowen/liebiao/202606/content_7072401.htm",
      "publishTime": "2026-06-16",
      "reason": "聚焦伊美和谈与中东地区和平稳定，国际关系考点明确。",
      "selected": true
    }
  ],
  "items": [
    {
      "id": "news-20260616-001",
      "title": "习近平同缅甸总统敏昂莱会谈",
      "source": "新华社（中国政府网发布）",
      "url": "https://www.gov.cn/yaowen/liebiao/202606/content_7072296.htm",
      "publishTime": "2026-06-16",
      "summary": "会谈强调中方将发展对缅关系置于周边外交重要位置，提出共同打造政治互信、发展互惠、安全协调、人文互鉴的中缅命运共同体，并就经济走廊建设、震后重建和打击网赌电诈等议题交换意见。",
      "keywords": ["中缅关系", "周边外交", "命运共同体", "跨境安全"],
      "policyBackground": "周边外交既服务国家发展大局，也连接区域稳定与边境治理。中缅合作同时涉及经贸联通、民生援助和跨境安全协同。",
      "shenlunAngles": [
        {
          "title": "周边外交与命运共同体建设",
          "explanation": "可围绕政治互信、互利合作和人文交流，分析周边命运共同体建设的现实意义。"
        },
        {
          "title": "发展合作与安全治理并重",
          "explanation": "经济走廊、震后重建和打击跨境犯罪并行推进，体现发展与安全统筹思维。"
        }
      ],
      "xingceLinks": [
        {
          "module": "常识判断",
          "point": "周边外交与和平共处五项原则",
          "explanation": "关注周边外交、命运共同体和跨境执法合作等政策表述。"
        }
      ],
      "materials": [
        "周边外交既要增进互信，也要把合作成果落到民生改善和安全稳定上。",
        "以发展合作夯实互信基础，以安全协同守护共同利益。"
      ],
      "examQuestions": [
        "结合中缅合作实践，分析周边命运共同体建设应把握哪些重点。",
        "围绕边境治理与跨境犯罪防控，提出协同治理建议。"
      ],
      "importance": 5,
      "tags": ["外交", "区域合作"],
      "verification": {
        "verifiedAt": "2026-06-17 09:18 +08:00",
        "status": "verified",
        "note": "中国政府网原文已访问核验"
      }
    },
    {
      "id": "news-20260616-002",
      "title": "李强会见缅甸总统敏昂莱",
      "source": "新华社（中国政府网发布）",
      "url": "https://www.gov.cn/yaowen/liebiao/202606/content_7072352.htm",
      "publishTime": "2026-06-16",
      "summary": "会见提出深化高质量共建“一带一路”合作，推进中缅经济走廊重大项目建设，拓展可再生能源、人工智能、数字经济等领域合作，并强调共同打击跨国犯罪、保障项目和人员安全。",
      "keywords": ["一带一路", "中缅经济走廊", "数字经济", "执法安全"],
      "policyBackground": "高质量共建“一带一路”强调项目质量、合作可持续性和发展安全协同，数字经济与绿色合作正在成为周边合作新增量。",
      "shenlunAngles": [
        {
          "title": "高质量共建“一带一路”",
          "explanation": "可从互联互通、产业协作、政策对接和民心相通等维度分析。"
        },
        {
          "title": "发展合作中的风险防控",
          "explanation": "项目推进需要与执法安全、人员保障和跨国犯罪治理同步设计。"
        }
      ],
      "xingceLinks": [
        {
          "module": "常识判断",
          "point": "区域经济合作",
          "explanation": "掌握“一带一路”、数字经济、可再生能源等合作关键词。"
        }
      ],
      "materials": [
        "合作走深走实，既靠项目牵引，也靠安全托底。",
        "把发展战略对接起来，才能把资源禀赋转化为共同发展动能。"
      ],
      "examQuestions": [
        "谈谈如何推动共建“一带一路”项目既见实效又防风险。",
        "围绕中缅经济走廊建设，概括可拓展的合作方向。"
      ],
      "importance": 4,
      "tags": ["对外合作", "发展安全"],
      "verification": {
        "verifiedAt": "2026-06-17 09:18 +08:00",
        "status": "verified",
        "note": "中国政府网原文已访问核验"
      }
    },
    {
      "id": "news-20260616-003",
      "title": "5月份国民经济运行总体平稳、向新向优",
      "source": "国家统计局（中国政府网发布）",
      "url": "https://www.gov.cn/lianbo/202606/content_7072257.htm",
      "publishTime": "2026-06-16",
      "summary": "国家统计局数据显示，5月份工业生产加快、装备制造业和高技术制造业增长较快，就业物价总体稳定，外贸韧性持续彰显，新动能继续壮大，国民经济延续总体平稳、向新向优的发展态势。",
      "keywords": ["宏观经济", "工业生产", "高技术制造业", "新动能"],
      "policyBackground": "观察经济运行既要看总量，也要看结构变化和新质生产力培育情况。工业、服务、投资和消费指标共同构成宏观判断基础。",
      "shenlunAngles": [
        {
          "title": "稳中有进的经济运行逻辑",
          "explanation": "可从政策发力、生产恢复、结构优化和预期改善等角度概括。"
        },
        {
          "title": "新动能与高质量发展",
          "explanation": "高技术制造业、知识产权产品投资等指标可作为创新驱动和产业升级论据。"
        }
      ],
      "xingceLinks": [
        {
          "module": "资料分析",
          "point": "经济指标阅读",
          "explanation": "可练习工业增加值、消费、投资等同比增速和结构性变化理解。"
        },
        {
          "module": "常识判断",
          "point": "宏观经济政策",
          "explanation": "关注稳中求进、新发展理念、新发展格局等高频表述。"
        }
      ],
      "materials": [
        "看经济既要看速度，也要看结构、质量和后劲。",
        "新动能成长壮大，是经济向新向优的重要支撑。"
      ],
      "examQuestions": [
        "结合5月份经济运行情况，分析我国经济韧性的主要体现。",
        "围绕培育新动能，提出促进高质量发展的政策建议。"
      ],
      "importance": 5,
      "tags": ["经济", "高质量发展"],
      "verification": {
        "verifiedAt": "2026-06-17 09:18 +08:00",
        "status": "verified",
        "note": "中国政府网发布的国家统计局原文已访问核验"
      }
    },
    {
      "id": "news-20260616-004",
      "title": "王毅出席上海合作组织成立25周年招待会",
      "source": "新华社（中国政府网发布）",
      "url": "https://www.gov.cn/yaowen/liebiao/202606/content_7072208.htm",
      "publishTime": "2026-06-16",
      "summary": "活动回顾上合组织成立25年来在安全、发展与文明互鉴上的合作成效，强调弘扬“上海精神”、完善全球治理、维护和平安宁、促进可持续发展，并释放中国愿与成员国共享发展机遇的信号。",
      "keywords": ["上合组织", "上海精神", "全球治理", "区域合作"],
      "policyBackground": "上合组织是我国周边和欧亚区域合作的重要平台，兼具安全合作、经济合作和人文交流功能。",
      "shenlunAngles": [
        {
          "title": "区域合作机制的制度价值",
          "explanation": "可从互信协作、平等协商和共同发展等方面分析上合组织经验。"
        },
        {
          "title": "中国方案与全球治理",
          "explanation": "将四大全球倡议与区域合作实践结合，可形成治理类材料。"
        }
      ],
      "xingceLinks": [
        {
          "module": "常识判断",
          "point": "国际组织与区域机制",
          "explanation": "关注上合组织宗旨、合作方向与“上海精神”。"
        }
      ],
      "materials": [
        "互信是区域合作的起点，共赢是合作走远的基础。",
        "把共同安全、共同发展和文明互鉴统一起来，区域合作才更有生命力。"
      ],
      "examQuestions": [
        "以上合组织为例，谈谈区域合作机制如何服务成员国共同发展。",
        "围绕全球治理改革，概括中国在区域平台中的作用。"
      ],
      "importance": 4,
      "tags": ["国际关系", "多边合作"],
      "verification": {
        "verifiedAt": "2026-06-17 09:18 +08:00",
        "status": "verified",
        "note": "中国政府网原文已访问核验"
      }
    },
    {
      "id": "news-20260616-005",
      "title": "王毅同巴基斯坦副总理兼外长达尔通电话",
      "source": "新华社（中国政府网发布）",
      "url": "https://www.gov.cn/yaowen/liebiao/202606/content_7072401.htm",
      "publishTime": "2026-06-16",
      "summary": "通话围绕伊朗与美国达成第一阶段谅解备忘录及后续和谈展开，强调和平来之不易，国际社会应继续为谈判提供助力，避免重新诉诸武力，并推动地区国家共同参与和平安全架构建设。",
      "keywords": ["中东局势", "劝和促谈", "伊美谈判", "地区安全"],
      "policyBackground": "中国在热点地区问题上强调政治解决、对话协商和共同安全，主张通过多边机制为和平进程创造条件。",
      "shenlunAngles": [
        {
          "title": "热点问题的政治解决路径",
          "explanation": "可围绕斡旋沟通、多边平台和地区国家主体性展开论述。"
        },
        {
          "title": "共同安全理念",
          "explanation": "和平稳定不能依赖单边强制，需要构建包容性的地区安全架构。"
        }
      ],
      "xingceLinks": [
        {
          "module": "常识判断",
          "point": "中国外交理念",
          "explanation": "掌握劝和促谈、政治解决和共同安全等关键词。"
        }
      ],
      "materials": [
        "和平的大门既已打开，就不应再次关上。",
        "地区和平要靠对话积累共识，也要靠各方共同维护。"
      ],
      "examQuestions": [
        "结合国际热点问题，分析政治解决路径为什么重要。",
        "围绕共同安全理念，提出促进地区和平稳定的建议。"
      ],
      "importance": 4,
      "tags": ["外交", "国际安全"],
      "verification": {
        "verifiedAt": "2026-06-17 09:18 +08:00",
        "status": "verified",
        "note": "中国政府网原文已访问核验"
      }
    }
  ]
}
