{
  "meta": {
    "type": "daily-news",
    "date": "2026-06-02",
    "generatedAt": "2026-06-02T09:15:00+08:00",
    "skillVersion": "codex-curated-daily-news-v2",
    "sourceCount": 4,
    "itemCount": 0,
    "candidateCount": 0,
    "selectionRule": "仅收录扫描日期当日发布、原文可核验且具备公考积累价值的权威条目；不足时保留真实数量，不以旧闻补足。",
    "scopeNote": "截至北京时间2026-06-02 09:15，已复核中国政府网、新华网时政频道、人民网首页与时政入口、教育部官网等权威入口。当前可直接检索并核验到的适合备考的权威条目主要集中在2026-05-27至2026-05-31，未将其冒充为2026-06-02当日时政写入本期文件。",
    "verifiedAt": "2026-06-02 09:15 +08:00"
  },
  "date": "2026-06-02",
  "title": "2026-06-02 每日时政热点",
  "summary": "截至北京时间2026-06-02 09:15，已复核主要权威入口，暂未检索到足量同日发布且适合纳入备考库的新增时政条目，本期按真实数量保留 0 条。",
  "candidateSources": [
    {
      "name": "中国政府网",
      "url": "https://www.gov.cn/",
      "checkedAt": "2026-06-02 09:15 +08:00",
      "result": "已核验首页与要闻入口；当前可直接定位的适合备考权威条目主要集中在 2026-05-31 及更早日期，未形成足量可直接写入本期的 2026-06-02 当日新增条目。"
    },
    {
      "name": "新华网时政频道",
      "url": "https://www.news.cn/politics/",
      "checkedAt": "2026-06-02 09:15 +08:00",
      "result": "已核验时政频道列表与近期重点条目；当前可验证的政策、民生和治理类报道主要集中在 2026-05-27 至 2026-05-31。"
    },
    {
      "name": "人民网首页与时政入口",
      "url": "https://www.people.com.cn/",
      "checkedAt": "2026-06-02 09:15 +08:00",
      "result": "已核验首页与党政/时政入口；截至本次扫描，未发现足量同日新增且原文链路清晰、适合纳入本期库的权威条目。"
    },
    {
      "name": "教育部官网",
      "url": "https://www.moe.gov.cn/",
      "checkedAt": "2026-06-02 09:15 +08:00",
      "result": "已核验近期政策与新闻发布入口；当前高价值教育政策条目集中在 2026-05-21 至 2026-05-22，不属于本次扫描日期。"
    }
  ],
  "candidatePool": [],
  "items": []
}
