{
  "meta": {
    "type": "daily-news",
    "date": "2026-05-27",
    "generatedAt": "2026-05-27T09:48:00+08:00",
    "skillVersion": "codex-curated-daily-news-v2",
    "sourceCount": 1,
    "itemCount": 5,
    "scopeNote": "本期收录人民日报/人民网于2026-05-27发布的可核验报道。事件事实来自原文；申论角度、行测关联与出题方向为备考加工内容。",
    "verifiedAt": "2026-05-27 09:48 +08:00"
  },
  "date": "2026-05-27",
  "title": "2026-05-27 每日时政热点",
  "summary": "今日重点关注理论传播机制建设、未成年人家庭保护、网络谣言治理、防汛救灾响应以及高水平开放与跨国公司合作。",
  "items": [
    {
      "id": "news-20260527-001",
      "title": "中宣部召开党的创新理论传播工程推进会",
      "source": "人民日报（人民网）",
      "url": "https://politics.people.com.cn/n1/2026/0527/c461001-40727945.html",
      "publishTime": "2026-05-27 06:13",
      "summary": "报道显示，中宣部于5月26日在京召开党的创新理论传播工程推进会，强调顺应数字化、网络化、智能化发展趋势，提升理论传播针对性、实效性和吸引力。",
      "keywords": ["理论传播", "宣传思想工作", "数字化传播", "基层宣讲"],
      "policyBackground": "推动党的创新理论大众化普及、精准化传播，是完善理论传播机制和工作格局的重要任务。传播方式需要适配不同受众与媒介场景。",
      "shenlunAngles": [
        {
          "title": "提升政策传播效能",
          "explanation": "可从内容通俗化、传播分众化、渠道数字化、反馈闭环化讨论公共传播能力建设。"
        },
        {
          "title": "让基层宣讲更可感可及",
          "explanation": "理论传播要联系群众关切和具体实践，避免单向灌输与形式化表达。"
        }
      ],
      "xingceLinks": [
        {
          "module": "政治理论",
          "point": "理论传播与群众路线",
          "explanation": "关注推进会主题与理论传播工程的工作导向。"
        }
      ],
      "materials": [
        "以分众化表达提升理论传播的抵达率，以数字化工具拓展服务群众的新场景。",
        "传播既要有高度，也要有温度，更要与基层实践同频共振。"
      ],
      "examQuestions": [
        "围绕提升基层政策宣讲实效，提出工作建议。"
      ],
      "importance": 4,
      "tags": ["政治理论", "基层治理"],
      "verification": {
        "verifiedAt": "2026-05-27 09:48 +08:00",
        "status": "verified",
        "note": "人民日报/人民网原文链接已访问验证"
      }
    },
    {
      "id": "news-20260527-002",
      "title": "最高法发布防范和惩治家庭内部侵害未成年人合法权益典型案例",
      "source": "人民日报（人民网）",
      "url": "https://society.people.com.cn/n1/2026/0527/c1008-40727979.html",
      "publishTime": "2026-05-27 06:17",
      "summary": "最高人民法院5月26日发布6件典型案例，涉及监护人履职、家庭暴力和抚养义务等问题，旨在推动家庭保护关口前移，依法保障未成年人合法权益。",
      "keywords": ["未成年人保护", "典型案例", "家庭保护", "司法治理"],
      "policyBackground": "家庭是未成年人保护的重要环节。典型案例以司法裁判明确监护责任和法律边界，为基层普法、风险发现和部门协同提供指引。",
      "shenlunAngles": [
        {
          "title": "构建未成年人保护闭环",
          "explanation": "可以从家庭尽责、学校发现、社区报告、司法救济和社会支持等维度展开。"
        },
        {
          "title": "以案释法促进预防治理",
          "explanation": "典型案例不仅解决具体争议，也具有规则指引和社会教育功能。"
        }
      ],
      "xingceLinks": [
        {
          "module": "常识判断",
          "point": "未成年人权益保护",
          "explanation": "注意家庭保护、监护职责和司法保护的政策背景。"
        }
      ],
      "materials": [
        "守护未成年人健康成长，需要把保护关口前移，把责任链条压实。",
        "以司法案例划清行为边界，以协同治理织密保护网络。"
      ],
      "examQuestions": [
        "分析发布家庭内部侵害未成年人权益典型案例的治理意义。",
        "拟写社区开展未成年人家庭保护普法活动的工作要点。"
      ],
      "importance": 5,
      "tags": ["法治建设", "未成年人保护"],
      "verification": {
        "verifiedAt": "2026-05-27 09:48 +08:00",
        "status": "verified",
        "note": "人民日报/人民网原文链接已访问验证"
      }
    },
    {
      "id": "news-20260527-003",
      "title": "公安部网安局重拳整治网络谣言",
      "source": "人民日报（人民网）",
      "url": "https://society.people.com.cn/n1/2026/0527/c1008-40727981.html",
      "publishTime": "2026-05-27 06:17",
      "summary": "公安部网安局公布5起打击整治网络谣言典型案例，涉及直播虚假摆拍、策划演绎虚假信息以及利用人工智能工具编造事故现场等行为，涉案人员已受到相应处理。",
      "keywords": ["网络谣言", "人工智能", "平台治理", "网络秩序"],
      "policyBackground": "生成式工具和短视频传播降低了伪造与扩散成本，网络治理需要兼顾依法惩治、平台责任、技术识别和公众媒介素养。",
      "shenlunAngles": [
        {
          "title": "规范新技术使用边界",
          "explanation": "治理重点不在排斥技术，而在压实发布者责任、平台审核责任和追溯机制。"
        },
        {
          "title": "维护公共信任与社会秩序",
          "explanation": "虚假信息可能耗费公共资源、引发恐慌，应推动源头防范与快速辟谣并重。"
        }
      ],
      "xingceLinks": [
        {
          "module": "常识判断",
          "point": "网络空间法治治理",
          "explanation": "关注典型违法行为与依法处理的治理导向。"
        },
        {
          "module": "言语理解与表达",
          "point": "事实核验",
          "explanation": "训练辨析论据可靠性与信息来源可信度。"
        }
      ],
      "materials": [
        "技术应用不能突破法律底线，流量追逐不能损害公共秩序。",
        "以法治明确边界，以平台压实责任，以素养增强公众辨识能力。"
      ],
      "examQuestions": [
        "结合人工智能生成虚假内容现象，提出治理网络谣言的对策。"
      ],
      "importance": 5,
      "tags": ["数字治理", "公共安全"],
      "verification": {
        "verifiedAt": "2026-05-27 09:48 +08:00",
        "status": "verified",
        "note": "人民日报/人民网原文链接已访问验证"
      }
    },
    {
      "id": "news-20260527-004",
      "title": "国家防总办公室持续组织部署防汛救灾工作",
      "source": "人民日报（人民网）",
      "url": "https://society.people.com.cn/n1/2026/0527/c1008-40727953.html",
      "publishTime": "2026-05-27 06:15",
      "summary": "5月26日，国家防总办公室、应急管理部组织多部门会商研判强降雨趋势，部署重庆、湖北、安徽、湖南、贵州、江苏、河南等重点省份防汛救灾工作；国家防总启动针对贵州的防汛四级应急响应。",
      "keywords": ["防汛救灾", "应急响应", "风险研判", "基层治理"],
      "policyBackground": "强降雨防范处置要求监测预警、会商研判、应急响应、转移避险和救灾保障贯通协同，尤其需要守住基层一线安全关口。",
      "shenlunAngles": [
        {
          "title": "增强风险预警和响应联动",
          "explanation": "可以从部门会商、重点区域盯防、人员转移和物资保障讨论韧性治理。"
        },
        {
          "title": "压紧压实基层责任",
          "explanation": "防汛责任落实到网格和风险点，才能把预警转化为有效行动。"
        }
      ],
      "xingceLinks": [
        {
          "module": "常识判断",
          "point": "防汛应急响应",
          "explanation": "了解应急管理部门协同部署与响应机制。"
        }
      ],
      "materials": [
        "防汛救灾贵在关口前移、响应前置、力量下沉。",
        "以精准研判争取主动，以基层落实筑牢安全防线。"
      ],
      "examQuestions": [
        "围绕汛期基层防灾减灾能力建设，提出具体措施。"
      ],
      "importance": 5,
      "tags": ["应急管理", "民生保障"],
      "verification": {
        "verifiedAt": "2026-05-27 09:48 +08:00",
        "status": "verified",
        "note": "人民日报/人民网原文链接已访问验证"
      }
    },
    {
      "id": "news-20260527-005",
      "title": "中国是跨国公司面向未来布局的“必选地”",
      "source": "人民日报（人民网）",
      "url": "https://finance.people.com.cn/n1/2026/0527/c1004-40727951.html",
      "publishTime": "2026-05-27 06:14",
      "summary": "报道介绍，第七届跨国公司领导人青岛峰会将于6月15日至17日在青岛举行。本届峰会将围绕“携手‘十五五’ 向新向未来”主题，展示开放政策、市场机遇与创新空间。",
      "keywords": ["高水平开放", "跨国公司", "营商环境", "十五五"],
      "policyBackground": "面向跨国公司的机制性交流活动，是扩大高水平开放、稳定市场预期和推动产业链供应链创新合作的重要窗口。",
      "shenlunAngles": [
        {
          "title": "以制度型开放增强吸引力",
          "explanation": "可从规则透明、服务便利、创新生态和公平竞争环境分析外资信心。"
        },
        {
          "title": "共享大市场发展机遇",
          "explanation": "开放不仅是引进投资，也包括推动技术、产业与市场协同创新。"
        }
      ],
      "xingceLinks": [
        {
          "module": "政治理论",
          "point": "高水平对外开放",
          "explanation": "结合开放发展理念与制度型开放理解材料主题。"
        }
      ],
      "materials": [
        "以更高水平开放链接全球资源，以更优营商环境稳定发展预期。",
        "开放的中国大市场，为创新合作和互利共赢持续提供空间。"
      ],
      "examQuestions": [
        "分析优化营商环境对推动高水平开放的重要作用。"
      ],
      "importance": 4,
      "tags": ["经济发展", "对外开放"],
      "verification": {
        "verifiedAt": "2026-05-27 09:48 +08:00",
        "status": "verified",
        "note": "人民日报/人民网原文链接已访问验证"
      }
    }
  ]
}
