{
  "meta": {
    "type": "daily-news",
    "date": "2026-06-03",
    "generatedAt": "2026-06-03T08:40:00+08:00",
    "skillVersion": "codex-curated-daily-news-v2",
    "sourceCount": 4,
    "itemCount": 0,
    "candidateCount": 0,
    "selectionRule": "仅收录扫描日期当日发布、原文可核验且具备公考积累价值的权威条目；不足时保留真实数量，不以旧闻补齐。",
    "scopeNote": "截至北京时间2026-06-03 08:40，已复核中国政府网、新华网时政频道、人民网首页与时政入口、教育部官网等权威入口。当前可直接检索并核验到的政策、治理、民生类高价值条目主要集中在2026-05-31及更早日期，未将其冒充为2026-06-03当日时政写入本期文件。",
    "verifiedAt": "2026-06-03 08:40 +08:00"
  },
  "date": "2026-06-03",
  "title": "2026-06-03 每日时政热点",
  "summary": "截至北京时间2026-06-03 08:40，已复核主要权威入口，暂未检索到足量同日发布且适合纳入备考库的新增时政条目，本期按真实数量保留 0 条。",
  "candidateSources": [
    {
      "name": "中国政府网",
      "url": "https://www.gov.cn/",
      "checkedAt": "2026-06-03 08:40 +08:00",
      "result": "已复核首页与要闻入口；截至本次扫描，未检索到适合直接写入本期的2026-06-03同日新增政策治理类权威条目。"
    },
    {
      "name": "新华网时政频道",
      "url": "https://www.news.cn/politics/",
      "checkedAt": "2026-06-03 08:40 +08:00",
      "result": "已复核时政频道与今日更新结果；当日可见更新以国际、电讯快讯为主，未形成适合纳入公考备考库的同日政策治理类新增条目。"
    },
    {
      "name": "人民网首页与时政入口",
      "url": "https://www.people.com.cn/",
      "checkedAt": "2026-06-03 08:40 +08:00",
      "result": "已复核首页与时政入口；截至本次扫描，未发现足量同日新增且原文链路清晰、适合纳入本期库的权威条目。"
    },
    {
      "name": "教育部官网",
      "url": "https://www.moe.gov.cn/",
      "checkedAt": "2026-06-03 08:40 +08:00",
      "result": "已复核近期政策与新闻发布入口；当前高价值教育政策条目仍主要集中在更早日期，不属于2026-06-03本次扫描范围。"
    }
  ],
  "candidatePool": [],
  "items": []
}
