{
  "meta": {
    "type": "daily-news",
    "date": "2026-05-26",
    "generatedAt": "2026-05-27T09:05:00+08:00",
    "skillVersion": "codex-curated-daily-news-v1",
    "sourceCount": 5,
    "itemCount": 5,
    "scopeNote": "本期为最近可核验日报，收录2026-05-26当日发布或当日权威媒体报道的重要信息；页面中的政策角度与出题方向为备考整理，不等同于原文表述。",
    "verifiedAt": "2026-05-27 09:05 +08:00"
  },
  "date": "2026-05-26",
  "title": "2026-05-26 每日时政热点",
  "summary": "今日重点关注防汛救灾资金保障、消费数据口径、超龄劳动者权益、乡村教育师资补充以及处方药网络零售合规治理。",
  "items": [
    {
      "id": "news-20260526-001",
      "title": "两部门再次紧急预拨1.6亿元中央自然灾害救灾资金",
      "source": "新华网",
      "url": "https://www.xinhuanet.com/politics/20260526/ab3ec9a6d6574704bd9c1ab624513de6/c.html",
      "publishTime": "2026-05-26 15:49:58",
      "summary": "财政部、应急管理部在此前预拨基础上，再次紧急预拨1.6亿元中央自然灾害救灾资金，支持湖北、湖南、贵州做好洪涝和地质灾害救灾工作；5月以来已累计预拨6.26亿元支持相关地区开展防汛抗旱救灾。",
      "keywords": [
        "防汛救灾",
        "中央财政",
        "应急管理",
        "民生保障"
      ],
      "policyBackground": "汛期灾害应对涉及中央与地方协同、应急资金快速下达和受灾群众基本生活保障。公开报道显示，本次资金重点用于搜救转移安置、排危除险、倒损民房修复等应急救助事项。",
      "shenlunAngles": [
        {
          "title": "提升应急治理韧性",
          "explanation": "可围绕预警响应、资金快速拨付、基层执行和灾后恢复形成闭环治理展开分析。"
        },
        {
          "title": "守住民生安全底线",
          "explanation": "灾害治理既要保障生命安全，也要及时回应安置、住房修复和基本生活需求。"
        }
      ],
      "xingceLinks": [
        {
          "module": "政治理论",
          "point": "人民至上、生命至上",
          "explanation": "理解防灾减灾救灾工作中的民生导向与治理要求。"
        },
        {
          "module": "常识判断",
          "point": "应急管理与财政保障",
          "explanation": "关注中央自然灾害救灾资金及防汛救灾工作场景。"
        }
      ],
      "materials": [
        "以快速响应提升应急处置效率，以精准保障守护受灾群众基本生活。",
        "将风险防范、应急处置与灾后恢复贯通起来，提升基层治理韧性。"
      ],
      "examQuestions": [
        "结合救灾资金快速拨付，分析提升基层防灾减灾能力应重点解决哪些问题。",
        "围绕保障受灾群众基本生活，提出完善应急救助工作的措施。"
      ],
      "importance": 5,
      "verification": {
        "verifiedAt": "2026-05-27 09:05 +08:00",
        "status": "verified",
        "note": "新华网原文链接已访问验证"
      },
      "tags": [
        "社会治理",
        "公共安全"
      ]
    },
    {
      "id": "news-20260526-002",
      "title": "前4月商品和服务零售合并计算同比增长3.2%",
      "source": "人民日报（人民网）",
      "url": "https://cpc.people.com.cn/n1/2026/0526/c64387-40727449.html",
      "publishTime": "2026-05-26",
      "summary": "人民日报报道，国家统计局自2026年4月份起正式发布商品和服务零售额数据。前4月商品和服务零售额同比增长3.2%，其中服务零售额增长5.3%，反映消费统计向商品与服务并重拓展。",
      "keywords": [
        "消费",
        "服务零售",
        "统计口径",
        "经济运行"
      ],
      "policyBackground": "将服务零售纳入统一发布，有助于更全面观察居民消费变化，体现消费结构从实物商品向商品与服务并重演进的现实需要。",
      "shenlunAngles": [
        {
          "title": "适应消费转型完善统计监测",
          "explanation": "统计口径与消费形态同步变化，能够为扩大消费和优化供给提供更准确依据。"
        },
        {
          "title": "以优质服务释放消费潜力",
          "explanation": "可从文旅、健康、养老、数字服务等领域讨论提升服务供给质量。"
        }
      ],
      "xingceLinks": [
        {
          "module": "资料分析",
          "point": "同比增长和分类增速比较",
          "explanation": "可训练整体增长与分项增长信息的读取、比较和判断。"
        },
        {
          "module": "常识判断",
          "point": "消费统计新口径",
          "explanation": "理解商品与服务消费协同统计的经济背景。"
        }
      ],
      "materials": [
        "统计体系应跟上发展变化，更准确刻画消费的新业态、新场景和新需求。",
        "提升服务供给质量，是释放消费潜力、改善生活品质的重要路径。"
      ],
      "examQuestions": [
        "分析发布商品和服务零售额数据对促进消费高质量发展的意义。",
        "围绕提升服务消费供给水平，提出工作建议。"
      ],
      "importance": 4,
      "verification": {
        "verifiedAt": "2026-05-27 09:05 +08:00",
        "status": "verified",
        "note": "人民网原文链接已访问验证"
      },
      "tags": [
        "经济发展",
        "数据治理"
      ]
    },
    {
      "id": "news-20260526-003",
      "title": "五部门出台超龄劳动者基本权益保障暂行规定",
      "source": "泰安市人力资源和社会保障局（转载人社部政策）",
      "url": "https://rsj.taian.gov.cn/art/2026/5/26/art_47925_10321593.html",
      "publishTime": "2026-05-26",
      "summary": "人力资源社会保障部等五部门联合发布暂行规定，自2026年7月1日起施行。规定明确超龄劳动者享有劳动报酬、休息休假、劳动安全卫生、工伤保障等基本权益；用工单位应与超龄劳动者订立书面用工协议。",
      "keywords": [
        "劳动权益",
        "超龄劳动者",
        "就业保障",
        "社会治理"
      ],
      "policyBackground": "随着劳动者就业形态和年龄结构变化，依法保护超龄劳动者权益，需要在鼓励劳动参与与规范用工责任之间形成制度保障。",
      "shenlunAngles": [
        {
          "title": "让就业保障覆盖更加精准",
          "explanation": "可分析新就业和灵活就业背景下特殊群体的劳动保障需求。"
        },
        {
          "title": "平衡用工活力与权益保护",
          "explanation": "通过书面协议、工伤保障和监督检查，推动用工规范化。"
        }
      ],
      "xingceLinks": [
        {
          "module": "常识判断",
          "point": "劳动权益保障政策",
          "explanation": "留意施行日期、基本权益内容和用工单位义务。"
        },
        {
          "module": "政治理论",
          "point": "就业优先与公平保障",
          "explanation": "结合保障劳动者合法权益理解民生政策导向。"
        }
      ],
      "materials": [
        "就业服务既要拓展机会，也要以制度护航劳动者的基本权益。",
        "规范用工责任，是促进劳动力市场健康运行的重要基础。"
      ],
      "examQuestions": [
        "谈谈完善超龄劳动者基本权益保障制度的意义。",
        "假如你是基层人社部门工作人员，请提出推动规定落地的宣传服务措施。"
      ],
      "importance": 5,
      "verification": {
        "verifiedAt": "2026-05-27 09:05 +08:00",
        "status": "verified",
        "note": "政府部门网站转载页链接已访问验证"
      },
      "tags": [
        "就业",
        "法治保障"
      ]
    },
    {
      "id": "news-20260526-004",
      "title": "2026年全国计划招聘特岗教师8594名",
      "source": "新华网",
      "url": "https://www.news.cn/government/20260522/e6ab0af4e8c743b2a2bb35f263b83fc4/c.html",
      "publishTime": "2026-05-22 19:13:12",
      "summary": "教育部、财政部发布通知，2026年全国计划招聘特岗教师8594名，重点向原三区三州、乡村振兴重点帮扶县、少数民族地区等倾斜，并鼓励引导本科及以上毕业生到乡村学校任教。",
      "keywords": [
        "乡村教育",
        "特岗教师",
        "人才下沉",
        "乡村振兴"
      ],
      "policyBackground": "农村义务教育阶段学校教师特设岗位计划，通过补充乡村教师队伍、优化师资结构，为教育公平和乡村发展提供人才支持。",
      "shenlunAngles": [
        {
          "title": "以人才保障促进教育公平",
          "explanation": "可从资源倾斜、师资留用、职业成长和教育质量提升分析。"
        },
        {
          "title": "推动人才服务基层",
          "explanation": "基层岗位需要既引得来，也留得住、发展好的人才保障机制。"
        }
      ],
      "xingceLinks": [
        {
          "module": "常识判断",
          "point": "特岗计划与乡村教育",
          "explanation": "掌握计划定位、倾斜区域和招聘导向。"
        },
        {
          "module": "政治理论",
          "point": "教育公平与乡村振兴",
          "explanation": "理解公共服务均等化与人才支撑作用。"
        }
      ],
      "materials": [
        "让优质师资向基层流动，是促进教育公平、夯实乡村发展根基的重要举措。",
        "基层人才工作既要加大引进力度，也要完善成长与保障机制。"
      ],
      "examQuestions": [
        "分析特岗教师计划对推进乡村教育发展的作用。",
        "围绕留住乡村青年教师，提出综合保障建议。"
      ],
      "importance": 4,
      "verification": {
        "verifiedAt": "2026-05-27 09:05 +08:00",
        "status": "verified",
        "note": "新华网原文链接已访问验证"
      },
      "tags": [
        "教育",
        "乡村振兴"
      ]
    },
    {
      "id": "news-20260526-005",
      "title": "处方药网络零售合规指南发布",
      "source": "新华网",
      "url": "https://www.xinhuanet.com/20260526/4145779be0db40838b9a251a2f952213/c.html",
      "publishTime": "2026-05-26",
      "summary": "国家药监局发布《处方药网络零售合规指南》，要求药品零售企业严格履行主体责任，网络销售处方药实行实名制，并按照规定进行处方审核调配、风险控制和信息展示。",
      "keywords": [
        "网络售药",
        "药品安全",
        "平台治理",
        "合规监管"
      ],
      "policyBackground": "网络购药便利性提升的同时，处方审核、用药安全和平台责任更加重要。通过合规要求规范网络零售流程，是便利服务与风险防控并重的治理举措。",
      "shenlunAngles": [
        {
          "title": "数字便民服务必须守住安全底线",
          "explanation": "新业态治理需要在便捷可及与生命健康安全之间实现平衡。"
        },
        {
          "title": "压实平台和经营主体责任",
          "explanation": "可围绕实名购药、处方审核、追溯监管和公众提示展开。"
        }
      ],
      "xingceLinks": [
        {
          "module": "常识判断",
          "point": "药品网络零售监管",
          "explanation": "关注处方药实名制、处方审核以及企业主体责任等规则。"
        },
        {
          "module": "言语理解与表达",
          "point": "规范与便利的关系",
          "explanation": "可用于理解政策文本中安全底线与便民服务的逻辑关系。"
        }
      ],
      "materials": [
        "数字化服务越便捷，越需要将安全责任嵌入全流程。",
        "以规范守住底线，以技术提升服务，让便利与安全相得益彰。"
      ],
      "examQuestions": [
        "围绕网络处方药销售，分析平台经济治理中便利与安全的关系。",
        "为开展安全用药宣传活动拟写一份宣传提纲。"
      ],
      "importance": 4,
      "verification": {
        "verifiedAt": "2026-05-27 09:05 +08:00",
        "status": "verified",
        "note": "新华网原文链接已访问验证"
      },
      "tags": [
        "健康治理",
        "数字监管"
      ]
    }
  ]
}
