{
  "meta": {
    "type": "daily-news",
    "date": "2026-06-05",
    "generatedAt": "2026-06-05T08:43:08+08:00",
    "skillVersion": "codex-curated-daily-news-v2",
    "sourceCount": 4,
    "itemCount": 0,
    "candidateCount": 0,
    "selectionRule": "仅收录扫描当日发布且原文可访问核验、适合公考备考积累的权威时政；截至本次核验时未确认到 2026-06-05 当日新增且满足条件的条目。",
    "scopeNote": "截至 2026-06-05 08:43 +08:00，已手动复核新华网时政、人民网首页、教育部官网和中国政府网首页/政务联播入口；当前可见权威信息以 2026-06-04 及更早发布内容为主，未补录旧闻冒充 2026-06-05 当日时政。",
    "verifiedAt": "2026-06-05 08:43 +08:00"
  },
  "date": "2026-06-05",
  "title": "2026-06-05 每日时政",
  "summary": "截至 2026-06-05 08:43 +08:00，已按技能要求手动复核权威入口，未确认到 2026-06-05 当日新增且适合纳入备考卡片的可核验时政条目，今日收录 0 条。",
  "candidateSources": [
    {
      "name": "新华网时政",
      "url": "https://www.news.cn/politics/",
      "checkedAt": "2026-06-05 08:43 +08:00",
      "result": "手动复核时政频道首页，当前可见条目以 2026-06-04 及更早发布时间为主，未确认到 2026-06-05 当日新增且适合纳入的可核验时政原文。"
    },
    {
      "name": "人民网",
      "url": "https://www.people.com.cn/",
      "checkedAt": "2026-06-05 08:43 +08:00",
      "result": "手动复核人民网首页及党政入口，当前未确认到 2026-06-05 当日新增、可直接核验并适合纳入备考卡片的权威时政条目。"
    },
    {
      "name": "教育部官网",
      "url": "https://www.moe.gov.cn/",
      "checkedAt": "2026-06-05 08:43 +08:00",
      "result": "手动复核教育部官网，当前公开更新仍以前几日通知和活动稿件为主，未确认到 2026-06-05 当日新增且需纳入的条目。"
    },
    {
      "name": "中国政府网",
      "url": "https://www.gov.cn/",
      "checkedAt": "2026-06-05 08:43 +08:00",
      "result": "手动复核中国政府网首页及政务信息入口，截至本次扫描未确认到 2026-06-05 当日新增且适合纳入的可核验条目。"
    }
  ],
  "candidatePool": [],
  "items": []
}
